Subject,Topic,Key Texts,Core Concepts,Practices,Schools and Lineages,Historical Context,Contemporary Relevance,Error
"Historical development of Tantra and Agamas - origins, medieval systematization, regional variations, and modern interpretations","Historical development of Tantra and Agamas - origins, medieval systematization, regional variations, and modern interpretations","The literature of Tantra and Agamas is vast and forms the canonical texts for the Shaiva, Shakta, and Vaishnava traditions, often superseding the Vedas in ritual practice.

*   **Shaiva Agamas:** Traditionally 28 in number, they are the scriptural basis for Shaiva Siddhanta and other Shaiva schools. They are divided into four sections (*padas*): *Jnana* (knowledge), *Yoga* (practice), *Kriya* (temple building and rituals), and *Charya* (conduct).
*   **Shakta Tantras:** Traditionally 64 in number, these texts focus on the worship of the Divine Feminine (*Shakti*). The term ""Tantra"" is most commonly associated with this body of literature. Significant texts include the *Mahanirvana Tantra* and the *Kularnava Tantra*.
*   **Vaishnava Agamas:** These are primarily the **Pancharatra Samhitas** (108 texts) and the **Vaikhanasa Samhitas**. They focus on the worship of Vishnu and his forms, temple construction, and ritual.
*   **Kashmir Shaivism Texts:** Key texts include the **Malinivijayottara Tantra** and the **Vijnana Bhairava Tantra** (a dialogue between Shiva and Shakti on 112 methods of meditation). The **Tantraloka** by the 10th-century philosopher Abhinavagupta is a monumental and systematic exposition of the entire Tantric system.

The significance of these texts lies in their practical, ritualistic, and philosophical content, which provides a complete system for spiritual realization that is accessible to all, regardless of caste or gender, a radical departure from the earlier Vedic orthodoxy.","The core philosophical concepts of Tantra and Agamas revolve around the central idea of **Shakti** (the Divine Feminine, the creative power) and its inseparable union with **Shiva** (the Divine Masculine, pure consciousness). This non-dualistic reality, often termed **Advaita** (monism) in schools like Kashmir Shaivism, posits that the entire universe is a manifestation of this divine consciousness. Key concepts include:

*   **Microcosm-Macrocosm Principle:** The belief that the human body (*pinda*) is a miniature replica of the cosmos (*brahmanda*). Liberation is achieved by realizing the divine within the body.
*   **Subtle Body (*Sūkṣma Śarīra*):** The understanding of the body as a network of energetic channels (*Nadis*), psychic centers (*Chakras*), and the latent spiritual energy (*Kundalini*) coiled at the base of the spine.
*   **Moksha and Bhoga:** Tantra uniquely seeks to achieve both **liberation** (*Moksha*) and **enjoyment** (*Bhoga*) in this life, rejecting the ascetic notion that the world must be renounced. The world is seen as a field for spiritual practice, not an obstacle.
*   **Non-Dualism (*Advaita*):** While some Agamas are dualistic (Dvaita), the most influential Tantric schools, such as Kashmir Shaivism, are monistic, asserting the absolute oneness of the individual soul (*Atman*) and the Ultimate Reality (*Brahman* or *Shiva*).","Tantric and Agamic practices are highly systematic and aim for the direct experience of the divine within the body and the world. The practices are categorized into four stages: *Charya* (external conduct), *Kriya* (external ritual), *Yoga* (internal discipline), and *Jnana* (knowledge).

*   **Mantra and Yantra:** The repetition of sacred syllables (*Mantras*) and the use of geometric diagrams (*Yantras*) are fundamental. Mantras are believed to be the sound-body of the deity, and Yantras are visual tools for meditation and invocation.
*   **Ritual Worship (*Puja*):** Agamic traditions are the foundation of temple worship, which involves elaborate rituals for the invocation, bathing, dressing, and feeding of the deity image (*Murti*).
*   **Yoga and Subtle Body Practices:** This includes *Hatha Yoga* (physical postures), *Pranayama* (breath control), and the practice of awakening the **Kundalini** energy and guiding it through the *Chakras* to achieve union with Shiva at the crown.
*   **Transgressive Practices (*Vamachara*):** Certain schools, such as the *Kaula* tradition, engaged in practices that deliberately transgressed social norms (e.g., the use of the five *M*s: *madya* (wine), *mamsa* (meat), *matsya* (fish), *mudra* (parched grain), and *maithuna* (ritual intercourse)) to achieve a non-dual state by confronting and transcending conventional purity and impurity. These practices are highly esoteric and often symbolic.","Tantra and Agamas are not a single monolithic tradition but a collection of diverse schools and lineages that developed across the Indian subcontinent.

*   **Shaiva Traditions:**
    *   **Shaiva Siddhanta:** A dualistic (Dvaita) tradition prominent in South India, which forms the basis of temple ritual and philosophy.
    *   **Kashmir Shaivism:** A highly influential non-dualistic (Advaita) tradition that flourished in Kashmir, emphasizing the spontaneous recognition (*Pratyabhijna*) of one's own divine nature as Shiva.
    *   **Pashupatas and Kapalikas:** Early, often ascetic and transgressive, Shaiva sects that played a significant role in the early development of Tantra.
*   **Shakta Traditions:** These traditions focus on the worship of the Goddess (*Devi* or *Shakti*).
    *   **Sri Kula:** Centered on the worship of the beautiful goddess Tripura Sundari, often associated with the *Sri Yantra*.
    *   **Kali Kula:** Centered on the worship of the fierce goddess Kali, often associated with the *Kaula* or *Vamachara* (Left-Hand Path) practices.
*   **Vaishnava Traditions:**
    *   **Pancharatra:** The primary Agamic tradition for Vaishnavism, focusing on the worship of Vishnu and his *vyuhas* (emanations).
    *   **Vaikhanasa:** Another Vaishnava tradition, primarily focused on temple ritual and worship.
*   **Buddhist Vajrayana:** Tantra also spread into Buddhism, forming the basis of Vajrayana (the Diamond Vehicle), which is the dominant form of Buddhism in Tibet.","Tantra and Agamas emerged as distinct traditions in **early medieval India**, roughly between the 5th and 9th centuries CE, though their roots can be traced to earlier ""proto-Tantric"" elements in the Vedas, Upanishads, and indigenous, non-Vedic traditions.

*   **Origins (Pre-5th Century CE):** Proto-Tantric elements included the focus on the body, energy work (*prana*), and the rise of the Mother Goddess cults. The *Atharvaveda* and certain Upanishads contain early references to *Nadis* and *Chakras*.
*   **Medieval Systematization (6th–13th Centuries CE):** This period saw the formalization of the traditions and the composition of the vast body of Tantra and Agama literature. This systematization occurred primarily in three major streams: **Shaiva** (e.g., Kashmir Shaivism), **Shakta** (focused on the Goddess), and **Vaishnava** (Pancharatra and Vaikhanasa Agamas). The traditions were characterized by a rejection of the strict Brahmanical ritualism and caste-based authority, emphasizing direct, embodied spiritual experience.
*   **Regional Variations:** Key centers of development included **Kashmir** (home to the non-dualistic Kashmir Shaivism), **Bengal** and **Assam** (strongholds of Shaktism and the *Kaula* tradition), and **South India** (where the Shaiva Siddhanta and Vaishnava Agamas became the foundation for temple culture).
*   **Modern Interpretations:** Following the decline of many esoteric schools, the traditions were often misunderstood or condemned. The 20th century saw a resurgence, particularly in the West, leading to both scholarly rediscovery and popular, often sensationalized, interpretations.","The contemporary relevance of Tantra and Agamas is multifaceted, extending far beyond their traditional religious contexts. In modern Hinduism, the Agamas remain the **living blueprint** for temple construction, ritual worship (*puja*), and the consecration of deities in the Shaiva, Vaishnava, and Shakta traditions. The philosophical and practical elements of Tantra have profoundly influenced **modern Yoga**, with concepts like *Chakras*, *Kundalini*, and *Nadis* becoming central to global wellness and spiritual movements. However, this modern interpretation is often a **Westernized and secularized** version, frequently misrepresenting or reducing the complex tradition to a focus on sexuality or self-help, a phenomenon sometimes referred to as ""Neo-Tantra."" Authentic lineages, particularly in Kashmir Shaivism and Shaktism, continue to emphasize inner transformation, non-dual realization, and the integration of the material and spiritual worlds, offering a holistic path that remains deeply relevant in a fragmented modern society.",
