Subject,Topic,Key Texts,Core Concepts,Practices,Schools and Lineages,Historical Context,Contemporary Relevance,Error
"Tantric ritual practices - puja, sadhana, diksha (initiation), panchamakara, and worship methods","Tantric ritual practices - puja, sadhana, diksha (initiation), panchamakara, and worship methods","The foundational texts of the tradition are the **Agamas** and **Tantras**, which are theological treatises and practical manuals for divine worship, often presented as a dialogue between the god Shiva and the goddess Shakti. They provide detailed instructions for rituals, meditation, *mantras*, *mudras*, and temple construction.
*   **Shaiva Agamas:** Approximately 28 main texts (e.g., *Kāmikāgama*, *Suprabhedāgama*), focusing on the worship of Shiva.
*   **Shakta Agamas (Tantras):** Approximately 77 texts, focusing on the worship of the Goddess (Shakti).
*   **Vaishnava Agamas (Pancharatra Samhitas):** Approximately 108 texts, focusing on the worship of Vishnu.
The significance of these texts lies in their establishment of a non-Vedic, yet pervasive, ritual and philosophical framework that has been integrated into all major forms of modern Hinduism.","The philosophical foundation of Tantric ritual is **non-duality** and the assertion that all of material reality is sacred. The primary goal is **transformation *in* the world, via the body**, rather than transcendence of it. Key concepts include:
*   **Shakti:** The unlimited, dynamic, divine feminine power that animates all of creation. The Tantric worldview sees all material reality as a manifestation of Shakti.
*   **Shiva-Shakti Union:** The ultimate reality is the union of the passive, pure consciousness (Shiva) and the active, creative energy (Shakti). Rituals often aim to realize this union within the practitioner's own body.
*   **Kundalini and Chakras:** *Sadhana* focuses on awakening **Kundalini**, the individual's source of Shakti, visualized as a coiled serpent at the base of the spine. Through practices like *pranayama* and *mudra*, this energy is guided up the central channel (*sushumna nadi*) through a network of energy centers (**Chakras**) to achieve liberation.
*   **Transgression (Non-duality):** Tantra challenges conventional distinctions between opposites (pure/impure, sacred/profane), asserting that the divine can be found in the taboo. This concept underlies the most controversial rituals, which aim to shatter ego-led emotions like fear and aversion.","Tantric ritual practices are designed to harness the energy of the cosmos and the body for spiritual transformation.
*   **Sadhana (Spiritual Practice):** The path of practice, encompassing all Tantric disciplines, including Hatha Yoga, breath control (*pranayama*), and complex visualizations, with the ultimate goal of awakening Kundalini.
*   **Puja (Ritual Worship):** A powerful system of worship involving *mantra*, *mudra*, visualization, and offerings. The Tantric *Puja* is highly detailed, often involving a 12-step process that includes **bhutasuddhi** (purification of the elements) and **pranapratistha** (infusing the deity's presence into the object of worship). **Yoni Puja** is a specific ritual to worship Shakti, the Cosmic Mother, using the yoni as a symbol.
*   **Diksha (Initiation):** The essential ritual for entering the Tantric path, where the Guru purifies the disciple, removes mental and spiritual impurities, and transmits the spiritual power (*shakti*) and the *mantra* necessary for *Sadhana*.
*   **Panchamakara (The Five M's):** The five ritual elements: *Madya* (wine), *Mamsa* (meat), *Matsya* (fish), *Mudra* (parched grain/posture), and *Maithuna* (sexual union).
    *   **Vāmācāra (Left-Hand Path):** Interprets the Five M's literally, violating social taboos to achieve spiritual liberation through transgression.
    *   **Dakṣiṇācāra (Right-Hand Path):** Interprets the Five M's symbolically and metaphorically, e.g., *Maithuna* represents the union of the individual soul with the Divine (Shiva-Shakti).","Tantra is not a single tradition but a collection of schools and lineages that have influenced Hinduism, Buddhism, and Jainism.
*   **Shaiva Tantra:** Includes the **Kaula** (Kula) tradition, which emphasizes external practices (*bhoga* or enjoyment) and the use of the *Panchamakara*. The **Trika** system (e.g., Pratyabhijna school) of Kashmir Shaivism is a major philosophical lineage emphasizing the recognition of the self as Shiva. The **Aghoris** are a contemporary sect that continues the transgressive practices of the Left-Hand Path.
*   **Shakta Tantra:** Primarily focuses on the worship of the Goddess (Shakti). The **Shri Vidya** tradition is a major Shakta sect that uses the *Sri Yantra* and emphasizes the symbolic **Dakṣiṇācāra** path.
*   **Buddhist Tantra:** Known as **Vajrayana** (""Path of the Thunderbolt""), it flourished in Eastern India and was transmitted to the Himalayas by figures like the **Mahasiddhas**.
*   **Classification by Practice:** Lineages are sometimes classified as **Kaula** (external rituals), **Mishra** (mixed), and **Samaya** (purely internal, focusing on meditation).","Tantra emerged as a distinct esoteric yogic tradition on the Indian subcontinent around the **6th century CE**, developing initially within **Shaivism** and **Shaktism** during the Gupta and post-Gupta periods. It arose as a response to the changing spiritual landscape and a challenge to the more orthodox, ritualistic, and caste-bound Vedic traditions. Its appeal lay in its promise of power (*siddhi*) and liberation (*moksha*) achievable in a single lifetime, and its inclusive nature, which offered initiation (**Diksha**) to people from all social backgrounds, including women and the socially marginalized. The development of Tantra coincided with the rise of new kingdoms in medieval India, where rulers were often drawn to its promise of political and military power, incorporating Tantric deities as guardians in public temples. Tantra later spread and influenced **Buddhism** (as **Vajrayana**) and **Jainism**.","The contemporary relevance of Tantric ritual practices is multifaceted, with distinct manifestations in India and the West. In India, traditional lineages continue to practice *sadhana* and *puja* as core methods for spiritual transformation, with sects like the **Aghoris** maintaining the transgressive, literal interpretation of practices like the *Panchamakara*. In the West, Tantra has been largely reinterpreted as **Neo-Tantra**, which focuses on the symbolic and psychological aspects of the rituals. This Western form emphasizes meditation, movement, and visualization, often incorporating *puja* rituals (like *Yoni Puja*) to honor the divine feminine and masculine, frequently with a focus on sexual energy and intimacy as a path to spiritual union. The symbolic interpretation of the *Panchamakara* (the **Dakṣiṇācāra** path) is the dominant form in contemporary, mainstream practice. The role of **Diksha** remains central in traditional and many modern lineages as the necessary gateway to authentic *Sadhana*, signifying the transfer of spiritual power and knowledge from the Guru to the disciple, and is viewed as a process of spiritual purification and awakening. Tantra also influenced 20th-century movements, including the **Neo-Tantra** art movement and the counter-cultural movements of the 1960s and 70s, where it was often associated with ""free love"" and challenging social norms.",
"Major Tantra and Agama texts - Kularnava Tantra, Mahanirvana Tantra, Kamika Agama, and other foundational works","Major Tantra and Agama texts: Kularnava Tantra, Mahanirvana Tantra, and Kamika Agama","The major texts of the Tantra and Agama traditions are vast, but the three specified texts are foundational to their respective schools:

*   ***Kularnava Tantra* (The Ocean of Kula):**
    *   **Significance:** It is the most important and authoritative text of the **Kaula** school, a non-dualistic tradition within Shaktism and Shaivism [4]. It is framed as a dialogue between Shiva and Parvati.
    *   **Content:** It provides a comprehensive guide to the Kaula path, including the importance of the Guru, the process of initiation (*diksha*), the **Panchamakara** (five Ms) ritual (often interpreted symbolically), and the philosophical justification for using worldly enjoyment (*bhoga*) as a means to liberation (*moksha*) [4]. It famously states, ""As one falls on the ground, one must rise with the help of the ground,"" justifying the use of forbidden substances for spiritual purification (*Chitta-shodhana-sadhana*) [4].
*   ***Mahanirvana Tantra* (The Tantra of the Great Liberation):**
    *   **Significance:** A highly influential text, particularly in Bengal, known for its systematic presentation of Tantric philosophy and its attempt to create a more socially acceptable Tantric code [2]. It is often cited as the *Shastra* for the *Kaliyuga* (the current age) [2].
    *   **Content:** It details the creation and destruction of the universe, the nature of the Supreme Being (often identified as **Brahman** in a non-dualistic sense), and the mode of liberation [2]. It contains detailed instructions on rituals, including *puja* (worship), the use of *yantras* and *mantras*, and a clear exposition of the **Chakra and Kundalini** system [2]. It also includes a unique set of social and ethical injunctions, including a form of marriage (*Shiva-Shakti Vivaha*) and a more liberal approach to caste [2].
*   ***Kamika Agama* (The Desired Agama):**
    *   **Significance:** It is considered one of the *Mula Agamas* (root Agamas) and is a foundational scripture for the **Shaiva Siddhanta** tradition, particularly in South India [3].
    *   **Content:** The *Kamika Agama* is a primary source for the practical aspects of Shaiva worship. It provides exhaustive details on **temple construction** (*kriya*), the installation of deities (*murti sthapana*), the conduct of daily and special temple rituals (*charya*), and the philosophical tenets of Shaiva Siddhanta [3]. It is a manual for the entire life cycle of a temple and its community [3].

| Text | Primary Focus |
| :--- | :--- |
| **Kularnava Tantra** | Kaula philosophy, Guru-disciple relationship, ritual use of *Panchamakara*. |
| **Mahanirvana Tantra** | Systematic Tantric philosophy, Kundalini Yoga, social and ethical code for *Kaliyuga*. |
| **Kamika Agama** | Shaiva Siddhanta temple architecture, deity installation, and ritual worship. |","The core philosophical concepts of the Tantras and Agamas revolve around the dynamic interplay between the masculine and feminine divine principles, **Shiva** (Consciousness/Static) and **Shakti** (Energy/Dynamic) [1]. The ultimate reality is often viewed as a non-dual unity (*Advaita*), where the phenomenal world is not an illusion but a manifestation of this divine energy [1].

*   **Shiva-Shakti Union:** The cosmos is a result of the union of Shiva and Shakti. Liberation (*moksha*) is achieved by realizing this non-dual nature within oneself [2].
*   **Microcosm-Macrocosm:** The human body is considered a microcosm (*pinda*) of the macrocosm (*brahmanda*). All cosmic forces and deities reside within the body, making the body a sacred site for spiritual practice [1].
*   **Kundalini:** The latent divine energy (Shakti) coiled at the base of the spine (*Muladhara Chakra*). The goal of Tantric practice is to awaken this energy and guide it upward through the central channel (*Sushumna Nadi*) to unite with Shiva in the crown chakra (*Sahasrara*), leading to spiritual liberation [2].
*   **Tattva:** The principles of reality. The *Kamika Agama*, a foundational text of **Shaiva Siddhanta**, details the 36 *tattvas* (principles of existence) that constitute the universe, from pure consciousness to the gross elements [3].
*   **Kaula Philosophy (*Kularnava Tantra*):** The *Kularnava Tantra* is the foremost text of the Kaula school, which emphasizes the non-dualistic realization of the divine within the world. It famously advocates for the use of the very things that can cause a person's downfall (*bhoga*) as a means to liberation (*moksha*), a concept known as *Chitta-shodhana-sadhana* (purification of the mind) [4].

| Text | Core Philosophical Concept |
| :--- | :--- |
| **Kularnava Tantra** | **Kaula Marga** (Path of the Family/Clan), non-dualism, use of *bhoga* (enjoyment) for *moksha* (liberation). |
| **Mahanirvana Tantra** | **Shakti-centric Advaita** (non-dualism), detailed exposition of the **Chakra and Kundalini** system, and a focus on social ethics. |
| **Kamika Agama** | **Shaiva Siddhanta** philosophy, 36 *tattvas*, and the importance of *diksha* (initiation) for liberation. |","Tantric and Agamic practices are collectively known as **Sadhana** and are characterized by a focus on ritual, mantra, and the body as a vehicle for spiritual transformation [1].

*   **Diksha (Initiation):** This is the essential prerequisite for all Tantric and Agamic practice. It is the formal transmission of power and knowledge from the Guru to the disciple, which is believed to purify the disciple and make them fit for the path [3]. The *Kamika Agama* emphasizes *diksha* as necessary for self-salvation [3].
*   **Pūjā (Worship):** Tantric *pūjā* is often more elaborate and esoteric than Vedic worship, involving the use of *yantras* (mystical diagrams), *maṇḍalas* (cosmic diagrams), and specific *mudrās* (hand gestures) [1]. The *Mahanirvana Tantra* provides detailed instructions for the worship of the Goddess (Devi) [2].
*   **Mantra and Yantra:** The use of **Mantra** (sacred sound) and **Yantra** (sacred geometry) is central to the Mantramārga (Path of Mantra) [1]. Mantras are used for divine self-creation and to invoke the deity, while yantras serve as a dwelling place for the deity and a focus for meditation [1].
*   **Kundalini Yoga:** Practices aimed at awakening the **Kuṇḍalinī** energy, including specific *āsanas* (postures), *prāṇāyāma* (breath control), and *bandhas* (locks), are detailed in texts like the *Mahanirvana Tantra* [2].
*   **Kaula Rituals (*Kularnava Tantra*):** The *Kularnava Tantra* is known for its discussion of the **Panchamakara** (five Ms: *madya* - wine, *māṃsa* - meat, *matsya* - fish, *mudrā* - parched grain, and *maithuna* - ritual intercourse) [4]. These practices are often performed in a ritual circle (*chakra pūjā*) and are typically interpreted symbolically by non-Vāmācāra (left-hand path) schools, where the substances represent internal states or processes [4]. The text stresses that the goal is *Chitta-shodhana-sadhana* (purification of the mind) [4].
*   **Temple Rites (*Kamika Agama*):** The *Kamika Agama* focuses on *charya* (conduct) and *kriya* (action), which include the daily and occasional rites performed in a Shiva temple, ensuring the proper maintenance and worship of the deity and the temple structure [3].

| Text | Key Ritual/Practice |
| :--- | :--- |
| **Kularnava Tantra** | *Chakra Pūjā*, *Panchamakara* (often symbolic), *Diksha*. |
| **Mahanirvana Tantra** | *Devi Pūjā*, Kundalini and Chakra meditation, *Shiva-Shakti Vivaha* (ritual marriage). |
| **Kamika Agama** | Temple construction (*Kriya*), Deity installation, daily temple *Pūjā* (*Charya*). |","The texts under review are foundational to specific schools and lineages within the broader Hindu Tantric and Agamic traditions, which are primarily divided into Shaiva (Shiva-centric) and Shakta (Shakti-centric) streams [1].

*   **Kaula School (*Kularnava Tantra*):** The *Kularnava Tantra* is the definitive text of the **Kaula Marga** (Path of Kula), a highly influential, non-dualistic school within Shaktism and Shaivism [4]. The Kaula tradition is characterized by its radical approach to ritual, often involving the *Panchamakara*, and its emphasis on the direct, experiential realization of the divine [4]. The Kaula lineage is often associated with the **Kashmir Shaivism** tradition, which is also non-dualistic [1].
*   **Shaiva Siddhanta (*Kamika Agama*):** The *Kamika Agama* is a primary scripture for the **Shaiva Siddhanta** school, which is a major, historically influential, and largely dualistic or pluralistic tradition of Shaivism, particularly strong in South India [3]. This school is temple-centric, emphasizing *charya* (conduct), *kriya* (ritual), and *jnana* (knowledge) as the path to liberation [3]. The lineage is maintained through a succession of *Acharyas* (teachers) and the performance of *diksha* (initiation) [3].
*   **Bengal Shaktism (*Mahanirvana Tantra*):** The *Mahanirvana Tantra* is a key text for the Shakta traditions of Bengal, which are centered on the worship of the Goddess **Kali** [2]. This lineage is known for its systematic and philosophical approach to Tantra, attempting to integrate it with a non-dualistic Vedanta philosophy [2]. The text's influence is seen in the practices of various *Sampradayas* (traditions) that worship the Goddess as the Supreme Reality [2].

| Text | Associated School/Lineage | Primary Focus |
| :--- | :--- | :--- |
| **Kularnava Tantra** | **Kaula Marga** (often linked to Kashmir Shaivism) | Non-dualistic, radical ritualism. |
| **Mahanirvana Tantra** | **Bengal Shaktism** (Kali-centric) | Systematic philosophy, social ethics. |
| **Kamika Agama** | **Shaiva Siddhanta** | Temple-centric, ritual and architectural guidelines. |","The Tantra and Agama traditions emerged on the Indian subcontinent beginning in the middle of the **1st millennium CE** [1]. They represent a distinct stream of esoteric, yogic, and ritualistic traditions that developed alongside, and often in dialogue with, the Vedic tradition [5].

*   **Agamas (c. 5th century CE onwards):** The term *Agama* refers to a body of scriptures considered to be the word of Shiva, Vishnu, or Shakti. The **Shaiva Agamas**, such as the *Kamika Agama*, are generally considered to be among the earliest, likely existing by the 5th century CE [3]. They are foundational to the **Shaiva Siddhanta** school and primarily deal with temple construction (*kriya*), rituals (*charya*), and theology (*jnana*) [3]. The *Kamika Agama* itself is an ancient Śaiva Āgama scripture, with some scholars dating its core content to at least the 5th century CE [6].
*   **Tantras (c. 7th to 14th centuries CE):** The term *Tantra* is often used synonymously with *Agama* but generally refers to texts that focus more on *sadhana* (spiritual practice) and esoteric rituals [1]. The tradition flourished in the medieval period, influencing both Hinduism (Shaivism, Shaktism, Vaishnavism) and Buddhism (Vajrayana) [1].
*   ***Kularnava Tantra* (c. 10th–14th century CE):** This text is a key scripture of the **Kaula** tradition, a sub-school of Shaktism and Shaivism. Its composition is generally placed in the medieval period, and it is considered one of the most authoritative texts on the Kaula path [4].
*   ***Mahanirvana Tantra* (Later Text):** The *Mahanirvana Tantra* is generally considered a later text, possibly composed in the 18th or 19th century, or at least heavily redacted during that time [2]. It is a highly influential text, particularly in Bengal, and is known for its systematic presentation of Tantric philosophy and its attempt to reconcile Tantra with a more orthodox social and ethical framework [2].

The relationship between the Tantric/Agamic and Vedic traditions is complex. While some scholars view them as two separate streams, the traditions themselves often claim a Vedic basis, with texts like the *Kularnava Tantra* stating that the Tantra is the *Shastra* (scripture) for the current age (*Kaliyuga*) [5]. The Agamas, in particular, are considered by their followers to be as authoritative as the Vedas [5].

| Text | Estimated Period/Context |
| :--- | :--- |
| **Kamika Agama** | c. 5th century CE; foundational text of Shaiva Siddhanta. |
| **Kularnava Tantra** | c. 10th–14th century CE; key text of the Kaula school. |
| **Mahanirvana Tantra** | c. 18th–19th century CE (or later redaction); influential text in Bengal Shaktism. |","The philosophical and ritualistic traditions of the Tantras and Agamas continue to influence modern Hinduism, particularly in the practices of **Shaktism** and **Shaivism** [1]. The emphasis on the **divine feminine (Shakti)** and the **immanence of the divine** within the human body and the world has resonated with contemporary spiritual movements [1]. The concepts of **Kundalini Yoga** and the **Chakra system**, which are deeply rooted in Tantric texts like the *Mahanirvana Tantra*, have been widely adopted in global yoga and wellness practices, often in a secularized or simplified form [1]. The *Mahanirvana Tantra*'s focus on social and ethical duties, including a more liberal view on caste and the importance of the guru, remains a relevant ethical framework for modern practitioners [2]. Furthermore, the architectural and ritual guidelines of the *Kamika Agama* are still the foundation for the construction and worship in many South Indian Shiva temples, ensuring the continuity of the **Shaiva Siddhanta** tradition [3]. The Western Neo-Tantra movement, while often criticized for its focus on sexual practices, is a modern, albeit controversial, interpretation of Tantric principles [1].

| Text | Contemporary Influence |
| :--- | :--- |
| **Kularnava Tantra** | Continues to be the primary scriptural authority for the Kaula tradition; its non-dualistic philosophy influences modern non-dual schools. |
| **Mahanirvana Tantra** | Major source for modern Kundalini and Chakra practices; its ethical and social code is studied for a liberal Tantric perspective. |
| **Kamika Agama** | The foundational text for temple construction and daily worship in the Shaiva Siddhanta tradition, maintaining the integrity of temple rituals. |",
