Subject,Topic,Key Texts,Core Concepts,Practices,Schools and Lineages,Historical Context,Contemporary Relevance,Error
"Shaiva Agamas - the 28 Shaiva Siddhanta Agamas and their structure, philosophy, and ritual practices","Shaiva Agamas - The 28 Shaiva Siddhanta Agamas: Structure, Philosophy, and Ritual Practices","The **28 Shaiva Agamas** (also known as Śaiva Siddhānta Tantras) form the primary scriptural authority for the tradition, revealed by Shiva through his five faces (Sadyojata, Vamadeva, Aghora, Tatpurusha, and Ishana). They are broadly classified into two groups:
*   **10 Shiva Agamas (Sivabheda):** Including *Kāmika*, *Yogaja*, *Chintya*, *Kāraṇa*, and *Ajita*.
*   **18 Rudra Agamas (Rudrabheda):** Including *Vijaya*, *Niśvāsa*, *Svāyambhuva*, *Raurava*, and *Kiraṇa*.
Each Agama is traditionally structured into four sections (**Pādas**), which together cover the entire scope of the tradition: **Jñāna** (philosophy), **Yoga** (meditation), **Kriyā** (temple construction and rituals), and **Caryā** (conduct and ethics). The *Kriyā-pāda* is particularly significant as it contains the detailed, meticulous instructions that serve as the standard **pūjā manuals** for temple worship. Other key texts include the Tamil *Tirumurai* (devotional hymns) and the *Meykanda Shastras* (philosophical treatises).","The core philosophy of Shaiva Siddhanta, rooted in the Agamas, is a form of **pluralistic realism** or **dualism** (Dvaita/Bhedavāda), asserting the eternal existence and distinctness of three realities (**Tattvas**):
*   **Pati (Lord):** The supreme reality, **Shiva**, who is pure consciousness, eternally free, and the efficient cause of the universe.
*   **Pasu (Soul):** The individual soul, which is inherently pure but bound by the three bonds.
*   **Pāśa (Bond):** The three impurities that bind the soul to the cycle of transmigration (**Saṃsāra**):
    1.  **Āṇava:** The innate ignorance or egoity that limits the soul's infinite knowledge and power.
    2.  **Karma:** The law of action and consequence, which creates a chain of future experiences.
    3.  **Māyā:** The material cause of the universe, the primordial matter from which the world is evolved, which provides the soul with a body and world of experience.
Liberation (**Moksha**) is achieved through the removal of Pāśa by the grace (**Śaktinipāta**) of Shiva, leading to the soul's realization of its true nature and eternal union with the Lord.","The ritual and spiritual practices of the Shaiva Agamas are meticulously detailed in the **Kriyā-pāda** and **Caryā-pāda** of the texts. The path to liberation is often described in four progressive stages (**Caryā, Kriyā, Yoga, Jñāna**), which are not strictly sequential but represent different aspects of the spiritual life:
1.  **Caryā-pāda (Conduct):** Focuses on ethical and moral conduct, service to Shiva's devotees, cleaning the temple, and other external acts of devotion.
2.  **Kriyā-pāda (Ritual):** Governs the construction and consecration of temples, the installation of the deity (**pratiṣṭhā**), and the performance of daily and occasional temple rituals (**pūjā**). This is the foundation of the public, communal aspect of the tradition.
3.  **Yoga-pāda (Discipline):** Describes internal practices, including various forms of Yoga, breath control, and meditation, aimed at purifying the mind and body.
4.  **Jñāna-pāda (Knowledge):** The final stage, which involves the intellectual and intuitive understanding of the philosophical truths (Pati, Pasu, Pāśa) leading to the final realization of the soul's true nature and union with Shiva.","The Shaiva Agamas are the foundational texts for the **Shaiva Siddhanta** school, which is the most prominent and enduring lineage. This school is primarily divided geographically and philosophically:
*   **Sanskrit/Northern Siddhanta:** Systematized by Kashmiri scholars like Sadyojyoti, which was more pan-Indian in scope.
*   **Tamil/Southern Siddhanta:** The dominant form today, which integrated the Agamas with the Tamil devotional tradition of the Nayanars. The key philosophical lineage is the **Meykandar Sampradaya** (13th-14th century), which established the dualistic philosophy of the school.
The Agamas themselves are sometimes classified into **Sivabheda** (10 Agamas) and **Rudrabheda** (18 Agamas), which some scholars associate with different philosophical leanings, though all are foundational to the Siddhanta tradition. The tradition is maintained by the **Ādi Śaiva** or **gurukkaḷ** temple priests, who form a hereditary lineage dedicated to the ritual practices of the Agamas.","The Shaiva Agamas are ancient Tantric scriptures whose origins are complex, with early influences from both North and South India. The tradition was systematized in Sanskrit by thinkers like **Sadyojyoti** (c. 7th century) in the North, who drew on texts like the *Rauravatantra*. In the South, the Shaiva Siddhanta tradition merged with the powerful **Tamil Shaiva movement** (7th-9th centuries), which was expressed in the devotional poetry of the **Nayanars** (collected in the *Tirumurai*). The definitive philosophical systematization occurred in the 13th-14th centuries with the **Meykandar Sampradaya** in Tamil Nadu, founded by **Meykandar**, whose *Śivajñānabodham* established the dualistic framework of the school. The Agamas thus form the scriptural and ritual foundation for this mature philosophical system, bridging the ancient Tantric practices with the later Bhakti and philosophical traditions.","The Shaiva Agamas, particularly the Shaiva Siddhanta tradition, remain highly relevant today, primarily in South India (Tamil Nadu) and Sri Lanka, and in a syncretized form in Southeast Asia (e.g., Siwa Siddhanta in Indonesia). They form the living tradition of temple worship, providing the meticulous rules for the construction, consecration, and daily rituals of Shiva temples. The hereditary temple priests, known as **gurukkaḷ** or **Ādi Śaiva**, continue to follow the Kriyā-pāda of the Agamas as their standard manual for pūjā. Furthermore, the philosophical concepts of Pati, Pasu, and Pāśa offer a robust dualistic framework for spiritual practice, complementing the non-dualistic schools of Shaivism. The emphasis on ethical conduct (**Caryā**) and devotion (**Bhakti**) ensures its continued appeal as a comprehensive path for the modern devotee.",
"Shakta Tantras - including the 10 Mahavidyas, major Shakta Tantra texts, and goddess worship traditions","Shakta Tantras - including the 10 Mahavidyas, major Shakta Tantra texts, and goddess worship traditions","The literature of Shakta Tantra is vast, often referred to as the **Shakta Agamas** or **Tantras**, traditionally numbered at 64.
*   **Devi Mahatmya (c. 5th-6th Century CE):** A foundational text that is not strictly a Tantra but is the most important scripture for Shaktas. It narrates the Goddess's battles against demons, establishing her as the supreme, all-powerful deity. It is considered as important as the *Bhagavad Gita* in Shaktism.
*   **Devi-Bhagavata Purana:** A major Purana that elevates the Goddess (**Bhuvaneshvari**) to the status of *Brahman*, detailing her mythology and philosophical supremacy.
*   **Tripura Upanishad:** Historically one of the most complete introductions to Shakta Tantrism, distilling the core philosophy of **Srividya** into its verses.
*   **The Tantras (Agamas):** These texts provide the practical, ritualistic, and philosophical framework for Shakta practice.
    *   **Mahanirvana Tantra:** A widely known text that discusses the nature of the Goddess, social duties, and various forms of worship.
    *   **Saradatilaka Tantra (11th Century):** A key text on *mantra* and *yantra* construction, influential across various Tantric schools.
    *   **Yogini Tantra:** Focuses on the worship of the Goddess in her fierce forms and is associated with the regions of Assam and Bengal.
    *   **Kularnava Tantra:** A significant text for the **Kaula** tradition, detailing the integration of worldly life and spiritual practice.
*   **Mahavidya-specific Texts:** Numerous *Tantras* and *Puranas* are dedicated to individual Mahavidyas, such as the *Kali Tantra* (c. 15th century) and the *Tripura Rahasya* (a text on the teachings of Tripura Sundari).","The philosophical foundation of **Shakta Tantra** is rooted in the concept of **Shakti** as the ultimate, dynamic reality.
*   **Shakti as Brahman:** Unlike other Hindu schools that may view Brahman as a static, genderless absolute, Shaktism posits **Shakti** (the Divine Feminine) as the ultimate reality (**Mahadevi** or **Adi Parashakti**). She is the source, embodiment, and energy of the cosmos. The famous dictum is that **Shiva** (Consciousness) is inert without **Shakti** (Power/Energy); they are inseparable, like fire and its heat.
*   **The 10 Mahavidyas (Ten Great Wisdom Goddesses):** These are ten distinct manifestations of the Divine Mother, representing the entire spectrum of cosmic reality, from terrifying destruction to sublime beauty. They are not merely deities but personifications of deep spiritual truths and cosmic forces (**Mahavidya** literally means ""Great Wisdom"").
    *   **Kali:** Time, transformation, and the dissolution of the ego.
    *   **Tara:** The guiding star, the power of the Word (sound), and salvation.
    *   **Tripura Sundari (Shodashi):** Beauty, perfection, and the three worlds (waking, dreaming, deep sleep).
    *   **Bhuvaneshvari:** The Queen of the Universe, space, and the cosmos.
    *   **Chhinnamasta:** Self-decapitation, the sacrifice of the ego, and the power of sexual energy.
    *   **Bhairavi:** Fierce goddess, the power of spiritual fervor, and the heat of the ascetic's *tapas*.
    *   **Dhumavati:** The widow goddess, representing the void, suffering, and the unmanifest.
    *   **Bagalamukhi:** The power to paralyze enemies (internal and external), and the control of speech.
    *   **Matangi:** The outcaste goddess, the power of the spoken word, and pollution/purity.
    *   **Kamala:** The lotus goddess, prosperity, purity, and spiritual liberation.
*   **Kula and Kaula:** These concepts emphasize the integration of the material world and the body into spiritual practice, rejecting the ascetic renunciation of earlier traditions. The body is seen as a microcosm of the universe, and worldly enjoyment (*bhoga*) is transformed into spiritual liberation (*moksha*).
*   **Non-Dualism (Advaita):** Many Shakta Tantras, particularly the **Srividya** tradition, are fundamentally non-dualistic, asserting the identity of the individual soul (*jiva*) with the ultimate reality (*Shakti*).","Shakta Tantra practices are highly structured and involve a synthesis of ritual, yoga, and meditation, aimed at realizing the non-dual nature of the self and Shakti.
*   **Pūjā (Worship):** The central practice is the worship of the Divine Mother (**Devi**) in her various forms, often involving elaborate rituals. This includes:
    *   **Mantra:** The use of sacred sounds, such as the **Bija Mantras** (seed syllables) associated with each Mahavidya (e.g., *Krīṃ* for Kali, *Hrīṃ* for Tripura Sundari).
    *   **Yantra:** The use of geometric diagrams, such as the **Sri Yantra** (associated with Tripura Sundari), which are visual representations of the cosmos and the Goddess's energy.
    *   **Nyāsa:** The ritualistic touching of various parts of the body while reciting mantras, to install the energy of the deity within the practitioner's body.
*   **Sādhanā:** A disciplined spiritual practice that can range from simple devotion to complex esoteric rituals. The goal is to attain both worldly fulfillment (*bhukti*) and liberation (*mukti*).
*   **Kundalini Yoga:** A core Tantric practice focused on awakening the dormant spiritual energy (**Kundalini Shakti**) at the base of the spine and guiding it through the central channel (*Sushumna Nadi*) and the chakras to unite with Shiva (Consciousness) at the crown (*Sahasrara*).
*   **Kaula Practices (Vāmācāra):** These are the more esoteric and often controversial practices, sometimes involving the ""Five Ms"" (*Pañcamakāra*): *madya* (wine), *māṃsa* (meat), *matsya* (fish), *mudrā* (parched grain or ritual gestures), and *maithuna* (ritual sexual union). These practices are intended to transcend conventional dualities and transform taboo elements into tools for spiritual realization, typically performed only by advanced practitioners under strict guidance.
*   **Dakshinācāra (Right-Hand Path):** The more common and socially acceptable path, where the ""Five Ms"" are replaced by symbolic substitutes (e.g., coconut water for wine, ginger for meat).","Shakta Tantra is broadly divided into two main streams, which in turn contain various schools and lineages.
*   **Kālikula (Family of Kali):**
    *   **Focus:** Worship of the fierce, dynamic, and transformative forms of the Goddess, such as **Kali** and **Dhumavati**.
    *   **Region:** Predominantly associated with **East India** (Bengal, Assam, Orissa).
    *   **Practices:** Tends to be more associated with the esoteric **Kaula** (Vāmācāra) practices, emphasizing the transcendence of fear and social norms.
*   **Śrīkula (Family of Śrī/Lakshmi):**
    *   **Focus:** Worship of the beautiful, benevolent, and sovereign forms of the Goddess, primarily **Tripura Sundari** (Śrī).
    *   **Region:** Predominantly associated with **South India** (Tamil Nadu, Kerala) and **Kashmir**.
    *   **Lineage:** The most influential school is **Śrīvidyā** (""Auspicious Knowledge""), which is highly systematic, non-dualistic, and focuses on the worship of the **Śrī Yantra**.
*   **Relationship to Other Hindu Traditions:**
    *   **Shaivism:** Shaktism is deeply intertwined with **Shaivism**, often referred to as **Shakta-Shaivism**. The two are philosophically inseparable, with the Goddess (**Shakti**) being the active power of the God (**Shiva**). Many Shakta texts are presented as dialogues between Shiva and Shakti.
    *   **Vaishnavism:** While distinct, the Goddess is also revered in Vaishnavism, primarily as **Lakshmi** (consort of Vishnu) or **Radha** (consort of Krishna). Some Tantric traditions, like the **Vaishnava Agamas** (Pancharatra), also incorporate Tantric elements but focus on Vishnu.
    *   **Smarta Tradition:** Shaktism is one of the five primary deities (*pañcopāsanā*) worshipped by the Smarta tradition, alongside Shiva, Vishnu, Ganesha, and Surya, demonstrating its mainstream acceptance within Hinduism.","The worship of the Divine Feminine in India is ancient, with archaeological evidence of mother goddess figures dating back to the **Indus Valley Civilization** and the **Upper Paleolithic** site of Baghor I (c. 9000–8000 BCE).
*   **Vedic Roots:** The **Rig Veda** contains the **Devi Suktam** (10.125), a hymn where the Goddess proclaims herself as the ultimate reality (**Brahman**), the source of all existence. However, the Vedic tradition primarily focused on male deities.
*   **Emergence of Shaktism:** Shaktism emerged as a distinct denomination of Hinduism around the **4th to 7th centuries CE**, coinciding with the rise of the **Puranas**. The **Devi Mahatmya** (part of the Markandeya Purana, c. 5th-6th century CE) is a foundational text that establishes the Goddess (**Mahadevi**) as the supreme, all-powerful creator and preserver.
*   **Tantric Development:** Shakta Tantrism developed in the early medieval period (c. 6th century CE onwards), particularly in regions like **Kashmir, Bengal, and Assam**. It represented a shift from the purely ritualistic and ascetic Vedic path to a more experiential, body-positive, and esoteric path. The surge in Tantra development during the late medieval period (post-14th century) is also linked to a response to political instability and Islamic invasions.
*   **The Mahavidyas:** The concept of the **10 Mahavidyas** solidified in the post-Puranic, Tantric period, likely between the **10th and 14th centuries CE**. Their emergence marks a significant development in Shaktism, emphasizing the *Bhakti* (devotional) aspect alongside the *Tantric* (ritualistic) one, presenting the Goddess in a diverse, yet unified, pantheon of wisdom.","**Shakta Tantra** and the **Mahavidyas** maintain significant contemporary relevance, both in India and globally.
*   **Feminist and Ecological Interpretations:** The worship of the Divine Feminine (**Shakti**) resonates strongly with modern feminist and ecological movements. The concept of the Goddess as the ultimate reality, the source of all creation and energy, provides a powerful counter-narrative to patriarchal structures and a spiritual basis for environmental stewardship. The Mahavidyas, in particular, are seen as archetypes of female power, independence, and transformation.
*   **Psychological and Therapeutic Applications:** The Mahavidyas are increasingly interpreted through a psychological lens. Each Goddess represents a distinct aspect of the human psyche or a stage of spiritual transformation. For example, **Kali** is seen as the power to face and transcend the ego and fear, while **Tripura Sundari** represents the beauty and perfection of the fully realized self. Their contemplation is used in modern spiritual and therapeutic practices for self-discovery and emotional healing.
*   **Global Spiritual Movements:** **Srividya**, one of the major Shakta lineages, has a growing following in the West. Its practices, involving the **Sri Yantra** and specific mantras, are adopted by seekers looking for a structured, non-dualistic path that integrates the material and spiritual worlds.
*   **Integration with Yoga and Meditation:** Tantric practices, including **Kundalini Yoga** and various forms of mantra and yantra meditation, are widely integrated into modern yoga and mindfulness traditions, often stripped of their more esoteric or controversial elements, focusing instead on energy work and consciousness expansion.
*   **Cultural and Artistic Expression:** The imagery and mythology of the Mahavidyas continue to inspire contemporary Indian art, literature, and cinema, serving as enduring symbols of power, mystery, and the cyclical nature of existence.",
