Subject,Topic,Key Texts,Core Concepts,Practices,Schools and Lineages,Historical Context,Contemporary Relevance,Error
"Vaishnava Agamas (Pancharatra and Vaikhanasa) - their texts, philosophy, and temple worship traditions","Vaishnava Agamas (Pancharatra and Vaikhanasa) - their texts, philosophy, and temple worship traditions","The Vaishnava Agamas are comprised of numerous texts, known as *Samhitas*, which detail the philosophy, cosmology, and practical aspects of worship.

| Tradition | Key Texts and Significance |
| :--- | :--- |
| **Pancharatra** | **Pancharatra Samhitas:** A vast collection of over 200 texts, believed to have been composed between **600 CE and 850 CE**. Major examples include the *Pādma Samhita*, *Ahirbudhnya Samhita*, *Jaya Samhita*, *Sattvata Samhita*, and *Naradiya Samhita*. These texts are significant for establishing the **Vyūha doctrine** and providing detailed instructions for temple construction (*kriya*), icon installation (*pratishtha*), and daily worship (*charya*). |
| **Vaikhanasa** | **Vaikhanasa Samhitas:** A smaller, more cohesive group of texts traditionally attributed to the sage Vikhanasa and his disciples. Key texts include the *Kashyapa Samhita*, *Atri Samhita*, *Bhrigu Samhita*, and *Marichi Samhita*. These texts are significant for their **strict adherence to Vedic principles** and their detailed, conservative prescriptions for temple rituals and the consecration of images. |","The core philosophical concepts of the Vaishnava Agamas revolve around the supremacy of **Vishnu/Narayana** and the means to attain liberation (*moksha*) through devotion and ritual worship.

| Tradition | Core Philosophical Concepts |
| :--- | :--- |
| **Pancharatra** | **Vyūha Doctrine:** The concept of four emanations (Vyūhas) of the Supreme Being (Vāsudeva): **Vāsudeva** (the Supreme Self), **Saṃkarṣaṇa** (the individual soul and destroyer), **Pradyumna** (mind and creation), and **Aniruddha** (ego and maintenance). This doctrine provides a cosmological and psychological framework for creation and salvation. **Bhakti (Devotion):** Emphasizes *bhakti* (devotion) and *prapatti* (surrender) as the primary means of liberation, making it more accessible to all castes. |
| **Vaikhanasa** | **Fourfold Manifestation:** Rejects the Vyūha doctrine in favor of a fourfold manifestation of Vishnu: **Purusha** (the principle of life), **Satya** (the static aspect of the deity), **Achyuta** (the immutable aspect), and **Aniruddha** (the aspect of maintenance). **Iconic Worship:** Places great emphasis on the *archa* (iconic) form of the Lord as the most important form for worship, seeing the Godhead as the support of all. |
| **Shared** | **Supremacy of Vishnu:** Both traditions uphold Vishnu as the *Para Brahman* (Supreme Reality). **Importance of the Icon:** Both agree that the *murti* (icon) is the most important form of the Lord, as it facilitates worship and meditation. |","The practices prescribed by the Vaishnava Agamas are primarily focused on **temple worship (*archana*)** and the consecration of the deity's icon.

| Tradition | Ritual and Spiritual Practices |
| :--- | :--- |
| **Pancharatra** | **Rituals:** Emphasizes *pūjā* (worship) and *utsava* (festivals). The rituals are generally more elaborate and flexible, allowing for greater lay participation. The *dīkṣā* (initiation) process is central, making the tradition more inclusive. The *mantras* used are primarily Agamic and Tantric in nature. |
| **Vaikhanasa** | **Rituals:** Emphasizes a more **Vedic-centric** approach, with a greater focus on *homa* (fire sacrifices) and *yagnyas*. The rituals are highly conservative and strict, with the use of Vedic *mantras* being paramount. The priesthood is hereditary and restricted to Brahmins of the Vaikhanasa lineage. The daily worship (*nitya-pūjā*) is performed in five parts: *Abhigamana* (approach), *Upādāna* (collection of materials), *Ijyā* (worship), *Svādhyāya* (study), and *Yoga* (meditation). |
| **Temple Worship (Shared)** | Both Agamas provide minute details for: **Temple Architecture** (*prāsāda-lakṣaṇa*), **Iconography** (*pratimā-lakṣaṇa*), **Daily Worship** (*nitya-pūjā*), **Occasional Rites** (*naimittika*), and **Festivals** (*utsava*). The core of the practice is the service (*sevā*) to the *murti* (icon) of Vishnu. |","The Vaishnava Agamas are the liturgical foundation for the major Vaishnava schools, particularly the Sri Vaishnava tradition.

*   **Pancharatra:** This Agama is the primary liturgical source for the **Sri Vaishnava Sampradaya** founded by **Ramanuja**. The tradition is further divided into the **Vadakalai** (Northern Culture) and **Tenkalai** (Southern Culture) sub-sects, both of which follow the Pancharatra system for temple worship. It is also influential in the **Madhva Sampradaya** (Brahma Sampradaya).
*   **Vaikhanasa:** This tradition is a distinct, self-contained lineage. Its adherents are primarily a specific community of Brahmins who trace their lineage back to the sage Vikhanasa. They maintain their own distinct identity and strictly adhere to the Vaikhanasa Samhitas. They are the exclusive priests in major temples like the Tirumala Venkateswara Temple.
*   **Relationship to Other Hindu Traditions:** The Vaishnava Agamas are distinct from the **Shaiva Agamas** (which focus on Shiva) and the **Shakta Agamas** (which focus on the Goddess). However, all three share a common structure and emphasis on ritual, *mantra*, and *yantra*, placing them under the broader umbrella of Tantra. The Pancharatra tradition, with its emphasis on *bhakti*, is closely linked to the devotional movements of the Alvars (Tamil poet-saints) and the philosophical school of Vishishtadvaita (Qualified Monism) as articulated by Ramanuja. The Vaikhanasa tradition maintains a closer, more conservative link to the Vedic tradition.","The Vaishnava Agamas are divided into two primary schools: **Pancharatra** and **Vaikhanasa**.

*   **Pancharatra:** The movement originated around the late **3rd-century BCE**, centered on the worship of **Narayana** and the various forms (*avatar*) of Vishnu. It later merged with the ancient Bhagavata tradition. The term literally means ""five nights,"" often interpreted as referring to a five-day sacrifice performed by Narayana or a tradition of ""five knowledges."" The doctrine was systematized by the 1st-century CE in texts like the *Shandilya Sutras*.
*   **Vaikhanasa:** This tradition is considered to be **older** and more directly evolved from the **Vedas**, specifically the *Taittiriya Samhita* and *Taittiriya Brāhmaṇa* of the Krishna Yajur Veda. It is traditionally attributed to the Vedic sage **Vikhanasa** and his four disciples (Atri, Bhrigu, Marichi, and Kashyapa). The Vaikhanasa Samhitas were the original temple manuals for many early Vaishnava temples.
*   **Divergence and Relationship:** The two traditions co-existed for centuries. The Pancharatra system, with its greater emphasis on *bhakti* and accessibility, gained prominence, especially after the 11th century. The influential Vedanta theologian **Ramanuja** (founder of the Sri Vaishnava Sampradaya) preferred the Pancharatra system, which led to its adoption in many major temples, including the Sri Ranganathaswamy Temple. However, the Vaikhanasa tradition remains the exclusive liturgical system for the worship of Lord Venkateswara at the Tirumala Tirupati Temple.","The Vaishnava Agamas, particularly the Pancharatra and Vaikhanasa traditions, remain highly relevant as the foundational liturgical and architectural guides for the vast majority of major Vishnu temples across India and the world. Their continued practice ensures the preservation of ancient temple traditions, art, and ritual purity.

*   **Temple Management:** Major temples like the Tirumala Venkateswara Temple (Vaikhanasa) and the Sri Ranganathaswamy Temple, Srirangam (Pancharatra) continue to follow these Agamas strictly, making them living traditions.
*   **Sri Vaishnavism:** The Pancharatra Agama is central to the Sri Vaishnava Sampradaya, which is one of the largest and most influential Vaishnava traditions globally.
*   **Cultural Preservation:** The detailed prescriptions for *murti* (icon) creation, temple architecture, and daily rituals have preserved a significant portion of India's cultural and artistic heritage.
*   **Global Reach:** As Vaishnavism has spread globally, the Agamic principles for worship and temple construction have been adopted in temples established outside of India, ensuring continuity with the tradition's roots.",
"Kashmir Shaivism and Trika tradition - Abhinavagupta, Pratyabhijna philosophy, and key texts",,"The literature of Kashmir Shaivism is vast, but the most significant texts are:
*   ***Tantrāloka*** **(Light on the Tantras):** The magnum opus of **Abhinavagupta**. It is a monumental, encyclopedic treatise (in 37 chapters) that systematically synthesizes the entire body of Trika, Kaula, and Krama teachings, presenting a unified, non-dualistic vision of Tantra. It is formally a commentary on the *Mālinīvijayottara Tantra*.
*   ***Īśvara-pratyabhijñā-kārikā*** **(Verses on the Recognition of the Lord):** Composed by **Utpaladeva**, this text is the foundational work of the Pratyabhijñā school. It provides the logical and philosophical arguments for the doctrine of recognition, proving that the individual soul is Śiva.
*   ***Śiva Sūtras*** **(Aphorisms of Śiva):** Revealed to **Vasugupta**, this text is considered the primary scriptural authority (*āgama*) of the tradition. It consists of 77 aphorisms that outline the path to liberation through the recognition of one's divine nature.
*   ***Spandakārikā*** **(Verses on Vibration):** Attributed to **Bhaṭṭa Kallaṭa** (a student of Vasugupta), this text elaborates on the concept of *Spanda* (cosmic vibration or pulsation) as the dynamic aspect of Śiva's consciousness, which underlies all creation and experience.
*   ***Parātrīśikā Vivaraṇa:*** Abhinavagupta's commentary on the *Parātrīśikā*, a section of the *Rudrayāmala Tantra*, which is considered a key text of the Trika system.","The core philosophy of Kashmir Shaivism is the monistic, idealistic system of **Pratyabhijñā** (Recognition).
*   **Pratyabhijñā (Recognition):** The central concept, meaning ""re-cognition"" or ""direct knowledge of one's self."" It is the realization that the individual self (*jīva*) is non-different from the universal consciousness, **Śiva**. Liberation is not the attainment of something new, but the recognition of what has always been true.
*   **Śiva and Śakti:** Śiva is the transcendent, pure consciousness, while **Śakti** is the immanent, dynamic power of Śiva. The two are inseparable, like fire and its heat. Śakti is the power of absolute freedom (**Svatantrya**) through which Śiva creates, maintains, and dissolves the universe.
*   **Svatantrya (Absolute Freedom):** The inherent, unconditioned, and absolute power of will and action of Śiva. It is the creative impulse that manifests the universe.
*   **The 36 Tattvas:** Kashmir Shaivism posits 36 categories of existence (*tattvas*), which are the stages of manifestation from the pure consciousness of Śiva down to the gross physical elements. This system provides a detailed map of the cosmos and the process of cosmic evolution and involution.
*   **Aham (I-Consciousness):** The ultimate reality is the pure, self-luminous ""I"" or ""I-consciousness"" of Śiva. The individual's bondage is the contraction of this universal ""I"" into the limited ""I"" (*aṇu*) of the ego.","The spiritual practices in Kashmir Shaivism are classified into four means (*upāyas*) to liberation, which are not sequential but represent different levels of intensity and directness:
*   ***Anupāya*** **(No Means):** The highest and most direct path, suitable for the most advanced practitioners. It involves instantaneous, effortless recognition (*pratyabhijñā*) of one's Śiva-nature without any mental or physical effort.
*   ***Śāmbhavopāya*** **(Śiva's Means):** A path of pure will and consciousness, where the focus is on the awareness of the Self, transcending all thought (*vikalpa*). It involves a sudden shift in perspective, often triggered by the Guru's grace (*śaktipāta*).
*   ***Śāktopāya*** **(Śakti's Means):** The path of knowledge and mental discipline. It involves intense contemplation, focusing on the essential nature of reality, and purifying the mind through the use of mantra, meditation on non-dual concepts, and philosophical inquiry.
*   ***Āṇavopāya*** **(Individual Means):** The lowest, yet most common, path involving physical and gross practices. This includes *yoga* (breath control, postures), *dhyāna* (meditation on a form or object), *uccāra* (mantra recitation), and *sthānakalpanā* (focusing on a specific location in the body).
The tradition also incorporates the secret, ritualistic practices of the **Kaula** and **Krama** systems, which involve the worship of the Goddess (Śakti) and the use of triadic mandalas and cycles of consciousness. These practices, often performed in secret, are aimed at internalizing the non-dual realization.","Kashmir Shaivism is an umbrella term for several non-dualistic Shaiva traditions that flourished in Kashmir. The four main schools or systems are:
*   **Trika System:** The core lineage, named for its focus on triadic concepts (e.g., the three goddesses Parā, Parāparā, and Aparā; the three energies of Śiva: *icchā*, *jñāna*, *kriyā*). Abhinavagupta's work is the definitive exposition of Trika.
*   **Pratyabhijñā System:** The philosophical school, systematized by Somānanda and Utpaladeva, which provides the logical framework for the doctrine of Recognition. It is the intellectual backbone of Kashmir Shaivism.
*   **Spanda System:** Based on the *Śiva Sūtras* and *Spandakārikā*, this school focuses on *Spanda* (vibration or throb) as the dynamic, creative movement of consciousness.
*   **Kula System:** A tantric, householder-oriented system that emphasizes the unity of the spiritual and material worlds. It incorporates ritual practices, often involving a circle (*kula*) of practitioners, and is deeply integrated into the Trika synthesis.
*   **Krama System:** A tantric school focused on the sequential stages (*krama*) of consciousness, particularly the Kālī-based cycles of emanation and withdrawal. Abhinavagupta integrated the Krama's emphasis on the sequential unfolding of the divine power into his Trika system.
The most prominent modern lineage is that of **Swami Lakshmanjoo** (1907–1991), who was the last great living master of the tradition and whose teachings have been instrumental in its modern revival and spread.","Kashmir Shaivism, often used synonymously with the **Trika** tradition, emerged in the Kashmir Valley around the 9th century CE. It represents a synthesis and domestication of earlier, more radical **Kaula** and **Krama** tantric movements, adapting their views and practices to a more systematic, philosophical, and householder-friendly framework. The tradition is broadly divided into three main phases:
*   **The Agamic Phase (c. 800 CE):** Marked by the revelation of the *Śiva Sūtras* to **Vasugupta** (c. 800–850 CE), which laid the philosophical foundation. His student, **Bhaṭṭa Kallaṭa**, composed the *Spandakārikā*, establishing the **Spanda** (Vibration) school.
*   **The Pratyabhijñā Phase (c. 900–1000 CE):** This phase saw the development of the core philosophical system. **Somānanda** (c. 900 CE) wrote the *Śivadṛṣṭi*, and his student **Utpaladeva** (c. 925–975 CE) systematized the philosophy in his *Īśvara-pratyabhijñā-kārikā* (Verses on the Recognition of the Lord).
*   **The Synthesizing Phase (c. 975–1025 CE):** The tradition reached its zenith with **Abhinavagupta** (c. 975–1025 CE), a polymath who synthesized the Trika, Kaula, Krama, Spanda, and Pratyabhijñā schools into a single, comprehensive system. His works, especially the *Tantrāloka*, became the definitive exposition of Kashmir Shaivism. The tradition flourished until the 14th century, after which it declined due to political and social changes, though it was preserved by a few lineages.","Kashmir Shaivism, particularly the Pratyabhijñā philosophy, holds significant **contemporary relevance** as a non-dualistic spiritual path. It offers a direct, experiential approach to self-realization that resonates with modern seekers. The emphasis on the inherent divinity of the individual (**Aham**) and the world, rather than a distant God, provides a framework for integrating spiritual practice with daily life. The tradition has been popularized in the West through the work of scholars and practitioners like Swami Lakshmanjoo, and its teachings on consciousness, aesthetics (through Abhinavagupta's work on *Rasa*), and the nature of reality continue to influence modern philosophy, psychology, and non-dual spiritual movements. Its practical *upāyas* offer a structured method for self-inquiry and meditation that is accessible to contemporary practitioners.",
"Tantric philosophy - concepts of Shakti, Kundalini, chakras, mantras, yantras, and spiritual transformation","Tantric philosophy - concepts of Shakti, Kundalini, chakras, mantras, yantras, and spiritual transformation","The foundational scriptures are known as the **Tantras**, **Agamas**, and **Samhitas**. These texts, which emerged from the middle of the 1st millennium CE, lay out the philosophical and practical framework of the tradition. Key texts include the **Vigyan Bhairav Tantra** (a profound text on philosophy and practice), the **Kularnava Tantra**, the **Maha Nirvana Tantra**, and the **Rudra Yamala**. Their significance lies in their focus on *sādhana* (spiritual practice), *dīkṣā* (initiation), and a ritual framework that views the body as divine, reflecting the union of Shiva and Shakti as the path to liberation.","Tantric philosophy is fundamentally non-dualistic, viewing the universe as a manifestation of the divine. The core concepts are: \n\n*   **Shakti:** The dynamic, creative, feminine principle of the universe, the divine energy or power. It is the active aspect of the Absolute (Shiva).\n*   **Shiva:** The static, pure consciousness, the masculine principle. Liberation is achieved through the union of Shiva and Shakti.\n*   **Kundalini:** The coiled, dormant, divine energy (Shakti) residing at the base of the spine (Muladhara chakra). Its awakening and ascent through the central channel (*Sushumna Nadi*) is the central goal of Tantric practice.\n*   **Chakras:** Energy centers located along the spine, through which the Kundalini Shakti ascends. The process of spiritual transformation involves purifying and activating these centers, leading to the union of Kundalini with Shiva in the crown chakra (*Sahasrara*).\n*   **Mantras:** Sacred sounds, syllables, or phrases that are subtle vibrations used to restructure energetic patterns and invoke specific deities or states of consciousness. They are a key feature of the **Mantramārga** ('Path of Mantra').\n*   **Yantras:** Sacred geometric diagrams that serve as a visual representation of a deity or a cosmic concept. They are used as tools for meditation and to focus the mind and energy.","Tantric practices, collectively known as *sādhana*, are designed for spiritual transformation and liberation *in* the world, not *from* it. They include:\n\n*   **Dīkṣā (Initiation):** The formal process of receiving a mantra and instruction from a qualified guru.\n*   **Pūjā (Ritual Worship):** Elaborate rituals often involving the worship of the Goddess (Shakti) and the use of *yantras* and *maṇḍalas*.\n*   **Mantra Japa:** Repetitive recitation of mantras to purify the mind and invoke divine energy.\n*   **Kundalini Yoga:** A system of practices (including *āsana*, *prāṇāyāma*, *mudrā*, and *bandha*) specifically aimed at awakening the Kundalini Shakti and guiding its ascent through the chakras.\n*   **Dhyāna (Meditation):** Techniques for deep contemplation and realization of the non-dual nature of reality.\n*   **Bhoga (Worldly Enjoyment):** The embrace of worldly life and experiences as a means of spiritual growth, rather than renunciation.","Tantra is not a single monolithic tradition but a collection of diverse schools and lineages, primarily within Hinduism and Buddhism. \n\n*   **Hindu Tantra:** The two main branches are **Shaiva Tantra** (Shaivism) and **Shakta Tantra** (Shaktism). Key schools include **Kashmir Shaivism** (a non-dualistic tradition), **Trika** (a branch of Kashmir Shaivism), and various **Kaula** traditions, which often involve more transgressive practices.\n*   **Buddhist Tantra:** Known as **Vajrayana** ('Diamond Vehicle') or **Mantrayāna**, it is prominent in Indo-Tibetan Buddhism, Chinese Esoteric Buddhism, and Japanese Shingon Buddhism. It uses tantric methods to achieve enlightenment in a single lifetime.\n*   **Vaishnava Tantra:** Traditions like **Pancharatra** and **Vaikhanasa** also incorporate tantric elements, particularly in their temple rituals and *Agama* literature.","Tantra emerged on the Indian subcontinent beginning in the middle of the **1st millennium CE** (c. 500 CE onward), gaining prominence during the Gupta and post-Gupta eras. It arose from a confluence of pre-Vedic, indigenous, and yogic traditions, particularly those focused on the worship of the Great Goddess and Shiva. The texts, known as Agamas and Tantras, were a departure from the orthodox Vedic tradition, offering a path to liberation that was accessible to all castes and both genders. It flourished in regions like **Kashmir**, **Bengal**, and **Assam**, and its influence spread across the Indian subcontinent and into Southeast Asia.","Tantra remains highly relevant today, though its modern interpretation is often bifurcated:\n\n*   **Traditional Relevance:** Tantric principles and practices are integral to modern Yoga, particularly Kundalini Yoga, Hatha Yoga, and various forms of meditation. Temple worship (*Pūjā*) in many Hindu traditions continues to follow Tantric/Agamic guidelines. It offers a path of **inner transformation** and a spiritual worldview that embraces the body and the world as sacred.\n*   **Neo-Tantra:** In the West, a modern interpretation known as 'Neo-Tantra' has gained popularity. This movement often focuses heavily on **sacred sexuality** and personal growth, sometimes divorcing these practices from the broader philosophical and ritual context of traditional Tantra. Scholars emphasize that traditional Tantra's focus is on spiritual transcendence, with sexual practices being rare and highly restricted to initiated adepts.",
